{"schemaVersion":"dromio.browser-event.v1","eventId":"event-1","sequence":1,"occurredAt":"2026-07-16T00:00:00.000Z","type":"operation.completed","scope":{"tenantId":"tenant-1","applicationId":"app-1","userId":"user-1","threadId":"thread-1"},"requestId":"request-1","operationId":"browser.page.navigate","payload":{"status":"completed"},"nextCursor":"cursor-1"}
